,statement_id,statement,creator,validity,True_fleshes,True_smog_index,True_flesch_kincaid_grade,True_coleman_liau_index,True_automated_readability_index,True_dale_chall_readability_score,True_difficult_words,True_linsear_write_formula,True_difficult_words.1,True_gunning_fog,True_text_standard,characters,words,avg_word_length,numbers,sentences,unique_word_ratio,sentiment_index,hatred_index,support,opposed,neutral,Label
208,9,"covid-19 patients with recurrent epileptic seizures had more underlying neurological diseases than patients who had a history of epilepsy, but without a seizure. patients with new and recurring epileptic seizures have suffered covid-19 more serious/critics, which may lead to worse prognosis.",augmented,True,42.21,0.0,12.5,17.4,17.8,10.82,12,13.75,12,14.05,10th and 11th grade,292,42,5.88,0,2,0.79,0.0097,0.0255,0.994127035,0.002424647,0.003448245,1
134,45,"A substantial number of infected healthcare workers were asymptomatic 28.9%, and 35.5% were admitted to hospital. The mean length of hospital stay was 8.1 days. 70.1% of confirmed cases had been vaccinated against seasonal influenza.",human,True,55.91,10.8,7.2,11.2,8.9,12.56,11,4.3,11,10.8,10th and 11th grade,233,31,5.71,4,3,0.87,0.0261,0.0379,0.993058324,0.0038395,0.003102174,1
71,7,"In addition to standard medical interventions, various dietary supplements and vitamins, such as vitamin D, high-dose vitamin C, and a range of other essential nutrients, have been explored as potential adjunctive therapies for COVID-19. These supplements offer a promising rationale for their anti-COVID-19 activities, including immune system support and antioxidant properties. However, despite their widespread use and anticipated favorable tolerability, rigorous randomized trials are yet to provide conclusive evidence regarding their preventive or therapeutic effectiveness in combating COVID-19.",chatgpt,False,-5.68,22.1,20.5,20.89,23.3,14.44,41,24.0,41,25.27,20th and 21st grade,602,78,6.59,0,3,0.85,0.3383,0.0153,0.889399588,0.029059151,0.081541218,0
153,64,"We reached consensus on the applicability of diagnostic tools to provide testing algorithms for the use of antibody tests of high-affinity antibodies for asymptomatic subjects exposed to SARS-CoV-2. Antibody tests for high affinity antibodies should be performed ideally 21 days after potential infectious contact, given that most exposed individuals will have begun to produce antibodies by then.",human,True,17.17,0.0,17.9,17.12,21.0,12.53,19,22.25,19,19.82,17th and 18th grade,397,56,6.0,1,2,0.8,0.1011,0.0376,0.879832089,0.001914312,0.118253522,1
214,10,"although molecular testing has been the primary way to diagnose acute covid-19 infection, blood testing is important in diagnosing small infections or supporting breathing difficulties in cases where pathogen is no longer detectable in upper respiratory tract.",augmented,True,17.0,0.0,20.1,17.94,25.6,14.01,14,28.5,14,24.53,-1th and 0th grade,260,37,6.0,0,1,0.89,0.0866,0.0332,0.994071901,0.002659976,0.003268097,1
81,15,"We found that the number of cases of SARS-CoV-2 infection doubled every 1.56 days in barracks-style buildings, indicating a rapid spread within such communal settings. Additionally, our analysis revealed that apartment-style buildings experienced a comparatively slower rate of infection, with the corresponding doubling time estimated to be 2.65 days.",chatgpt,False,38.01,13.6,12.0,17.11,15.9,13.15,18,11.5,18,13.87,11th and 12th grade,352,47,6.19,2,2,0.83,0.0203,0.0447,0.003971011,0.994273961,0.001755004,0
169,0,it was found that the 5-day ivermectin course was safe and effective in the treatment of adult patients with a slight covid-19.,augmented,True,82.99,0.0,7.2,9.86,12.3,11.19,4,12.0,4,10.62,11th and 12th grade,127,22,4.68,1,1,0.91,0.531,0.0174,0.993033409,0.003819584,0.003146935,1
171,0,it was found that a 5-day course of ivermectin is safe and effective in the treatment of adult patients with mild covid-19.,augmented,True,82.99,0.0,7.2,8.82,11.4,11.19,4,12.0,4,10.62,10th and 11th grade,123,22,4.5,1,1,0.95,0.5668,0.0169,0.99316448,0.003676445,0.003158971,1
212,10,"although molecular testing was the main means of diagnosing the acute covid-19 infection, blood tests acquire a value for the diagnosis of minor infections or supporting the diagnosis of difficulty breathing in cases where the pathogen is no longer detected in the upper respiratory tract.",augmented,True,8.88,0.0,23.2,14.81,26.7,13.94,15,32.5,15,26.0,-1th and 0th grade,289,45,5.4,0,1,0.8,0.036,0.0281,0.994246066,0.002528268,0.003225678,1
142,53,Children with serious underlying medical conditions had a 1.79 times higher risk of severe COVID-19 than for healthy children. Children with obesity were found to be 2.87 times more likely to get severe COVID-19 than healthy children. Children with underlying conditions also had a 2.81 times higher risk of death from COVID-19 compared to healthy children.,human,True,70.5,9.3,5.7,11.28,8.6,8.89,8,4.833333333,8,7.29,8th and 9th grade,357,53,5.42,3,3,0.57,0.012,0.0383,0.105568521,0.875800014,0.018631438,1
96,7,"We reached consensus on the applicability of diagnostic tools to provide testing algorithms for the use of antibody tests of high-affinity antibodies for asymptomatic subjects exposed to SARS-CoV-2. Antibody tests for high affinity antibodies should be performed ideally 21 days after potential infectious contact, given that most exposed individuals will have begun to produce antibodies by then.",human,True,17.17,0.0,17.9,17.12,21.0,12.53,19,22.25,19,19.82,17th and 18th grade,397,56,6.0,1,2,0.8,0.1011,0.0376,0.879832089,0.001914312,0.118253522,1
141,52,"Among those with moderate COVID-19 disease, time to clinical improvement was 7 days in the CBP group, versus 8 days in the control group. The data show that administration of CBP is a safe treatment option for patients with COVID-19 disease with a favorable outcome in the rate of, and time to, clinical improvement.",human,True,52.53,0.0,12.6,10.39,15.0,10.53,13,17.0,13,14.5,14th and 15th grade,316,52,4.9,2,2,0.67,0.4753,0.0124,0.987557173,0.001324917,0.011117936,1
202,6,microscopic abnormalities have been observed with both finger and toenails with covid-19. this suggests that chilblans can be a symptom of covid-19.,augmented,True,68.77,0.0,6.4,13.96,11.2,10.64,6,5.5,6,8.04,5th and 6th grade,148,22,5.68,0,2,0.91,0.0138,0.0436,0.991851985,0.002049693,0.006098371,1
211,10,"although molecular tests have been the main way to diagnose covvi-19 acute infection, blood tests gain importance to diagnose minor infections or support the diagnosis of difficulty in breathing in cases where the pathogen is no longer detectable in the upper respiratory tract.",augmented,True,19.37,0.0,21.2,15.04,25.9,13.85,15,30.5,15,24.64,-1th and 0th grade,278,43,5.44,0,1,0.81,0.0511,0.0323,0.994108915,0.002092011,0.003799104,1
137,48,Weight gain was present in 87% and weight loss in 13% of patients hospitalized with COVID-19. Most patients present excess body weight according to body mass index. Covid-19 patients recovered their weight after hospitalization.,human,True,68.47,9.7,6.5,13.61,11.3,10.23,7,6.0,7,9.23,9th and 10th grade,228,32,5.81,2,3,0.78,0.0437,0.0213,0.989934862,0.00272769,0.007337418,1
181,1,"we evaluated 298 people and identified twelve positive cases. 75% of the positive cases were asymptomatic, while only 25% of positive cases reported symptoms that included fever, diarrhea and cough. our data confirms the importance of early identification of asymptomatic carriers.",augmented,True,32.19,15.0,12.2,15.25,13.1,10.86,14,11.16666667,14,15.24,14th and 15th grade,281,38,5.97,3,3,0.74,0.4177,0.0187,0.994080961,0.002458993,0.003460029,1
207,9,"covid-19 patients with repeated epileptic seizures had more underlying neurological diseases than in patients with epilepsy history but without a seizure. patients with new start-up and repeated epileptic seizures suffer from a more serious/critical covid-19, which can lead to a worse prognosis.",augmented,True,41.7,0.0,12.7,16.94,17.7,9.94,10,14.0,10,14.11,13th and 14th grade,296,43,5.84,0,2,0.74,0.0115,0.0277,0.993106186,0.002112981,0.004780849,1
148,59,"We reached consensus on the applicability of diagnostic tools to provide testing algorithms for the use of antibody tests of high-affinity antibodies for asymptomatic subjects exposed to SARS-CoV-2. Antibody tests for high affinity antibodies should be performed ideally 21 days after potential infectious contact, given that most exposed individuals will have begun to produce antibodies by then.",human,True,17.17,0.0,17.9,17.12,21.0,12.53,19,22.25,19,19.82,17th and 18th grade,397,56,6.0,1,2,0.8,0.1011,0.0376,0.879832089,0.001914312,0.118253522,1
18,16,"In the phase 1 trial, the potential vaccine formula generated a robust antibody response that remained consistently high in all participants 3 months after the second vaccination. In the phase 2 trial, the potential vaccine formula demonstrated improved safety outcomes.",chatgpt,False,25.8,0.0,14.6,15.66,15.8,12.52,15,15.0,15,16.0,15th and 16th grade,270,37,6.05,3,2,0.73,0.7833,0.0179,0.001784074,0.997257888,0.000958043,0
35,23,"Down Syndrome, a genetic condition caused by trisomy 21, is characterized by immune dysregulation and anatomical differences in the upper respiratory tract, which have been observed to potentially mitigate the severity of COVID-19 infections.",chatgpt,False,3.13,0.0,21.3,18.11,24.5,14.61,15,28.0,15,26.54,-1th and 0th grade,242,33,6.15,1,1,0.94,0.014,0.0467,0.984150231,0.006951191,0.008898648,0
49,20,"It appears that the mode of virus transmission involved various forms of transportation, including car travel on highways and motorways. Interestingly, certain aspects of travel, such as ""solo"" driving or passenger cars, which were initially perceived by the public as potentially advantageous, may have inadvertently contributed to the initial spread of the virus.",chatgpt,False,27.66,0.0,16.0,16.31,19.7,12.1,20,19.25,20,18.9,15th and 16th grade,365,53,5.74,0,2,0.83,0.0188,0.0357,0.336094767,0.556213081,0.107692137,0
175,1,"we evaluate 298 people and identify twelve positive cases. 75% of positive cases were asymptomatic, while only 25% of positive cases reported symptoms that included fever, diarrhea and cough. our data confirms the importance of early identification of asymptomatic carriers.",augmented,True,32.6,15.0,12.0,14.89,12.9,11.01,14,11.0,14,15.32,14th and 15th grade,274,37,5.97,3,3,0.76,0.3928,0.0161,0.994044125,0.002324418,0.003631579,1
149,60,A need for mechanical ventilation occurred in 31% of the anakinra-treated group and 75% of the control group. Successful weaning from supplemental oxygen was attained in 63% of the anakinra-treated group compared with 27% of the control group.,human,True,52.19,0.0,10.7,12.94,13.6,11.23,12,12.5,12,11.81,12th and 13th grade,243,34,5.65,4,2,0.65,0.2828,0.0206,0.00194186,0.995754123,0.002303985,1
11,5,"In Hawaii, white Caucasians comprise 10%, Asians including Japanese, Chinese, and other Asians account for 40%, Hawaiians for 20%, and Pacific Islanders mostly from Micronesia and Samoa comprise 5%. We discovered that the COVID-19 rate in the Asian group was the highest among all the groups, and they accounted for almost 50% of cases",chatgpt,False,60.99,0.0,11.5,11.78,16.7,12.29,13,16.5,13,15.24,11th and 12th grade,335,49,5.31,5,2,0.8,0.0569,0.0923,0.013505138,0.963618994,0.022875899,0
160,71,Early experience with COVID-19 patients suggests that gastrointestinal symptoms are common and associated with greater severity of illness.,human,True,19.37,0.0,15.0,21.11,19.5,15.06,9,13.0,9,16.09,14th and 15th grade,139,18,6.72,0,1,0.94,0.019,0.017,0.984045863,0.00713312,0.008820993,1
163,74,Intravenous recombinant ACE2 was reported as an effective therapy in severe COVID-19 by blocking the viral entry to target cells.,human,True,34.26,0.0,13.5,14.04,14.5,15.68,10,15.0,10,18.0,14th and 15th grade,129,20,5.45,0,1,1.0,0.266,0.0352,0.993843436,0.003082967,0.003073573,1
22,37,"Female COVID-19 patients had a higher risk of severe dengue than male patients in the main analysis (22.5% vs 17.8%). Pre-existing comorbidities associated with severe disease were diabetes, hypertension, renal disease, and cardiovascular disease.""",chatgpt,False,34.63,11.9,11.2,15.81,14.0,15.34,13,7.0,13,12.76,11th and 12th grade,248,32,6.16,2,3,0.88,0.0127,0.0494,0.006679305,0.987510204,0.005810446,0
189,4,the intravenous recombinant ace2 was reported as effective therapy in difficult covid-19 by preventing the virus into the target cells.,augmented,True,25.8,0.0,14.6,15.78,15.9,14.89,8,17.0,8,22.0,14th and 15th grade,135,20,5.75,0,1,0.9,0.2933,0.0324,0.991855621,0.004162703,0.003981646,1
199,6,microscopic anomalies have been observed in the fingers and nails of patients with covid-19. this suggests that gilblaines could be a symptom of covid-19.,augmented,True,76.22,0.0,5.6,12.51,10.3,11.47,7,5.5,7,6.47,5th and 6th grade,154,24,5.38,0,2,0.92,0.0147,0.0367,0.991761684,0.002171834,0.006066453,1
161,72,Patients hospitalized and in the ICU because of COVID-19 have a higher metabolism and require more calories than their non-COVID counterparts.,human,True,41.7,0.0,12.7,15.61,16.4,12.95,7,13.5,7,14.11,12th and 13th grade,142,21,5.76,0,1,0.95,0.02,0.0176,0.991535068,0.003287067,0.005177932,1
183,2,"during the 14-day study period, six patients survived, two were extubeized and one was released. the results imply white blood cells as a therapeutic target for covid-19.",augmented,True,66.23,0.0,7.4,11.77,10.4,11.91,9,6.75,9,8.36,11th and 12th grade,170,27,5.07,1,2,0.96,0.3045,0.0214,0.991733551,0.002073007,0.006193436,1
12,17,"Without the initial lockdown, vaccination, and increased physical distancing, we estimated only 1 million COVID-19 cases, and 10,000 deaths would occur in the UK over 10 years. In the best-case scenario, vaccination does not minimize community transmission without future periods of increased physical distancing.",chatgpt,False,23.77,0.0,15.4,17.0,18.5,12.98,15,16.5,15,16.07,16th and 17th grade,313,41,6.2,3,2,0.83,0.0369,0.0522,0.002537447,0.995308578,0.002153923,0
27,19,"After receiving a third Pfizer vaccine, individuals in the immunocompromised and senior population experienced reactions that were consistent with those observed in previous vaccinations. These reactions were largely self-resolving, with fatigue, myalgia, and fever being the most commonly reported systemic side effects (19.6%, 9.2%, and 8.1% respectively).",chatgpt,False,21.7,15.5,14.1,18.85,17.7,13.82,22,12.5,22,17.34,13th and 14th grade,358,44,6.57,3,2,0.84,0.0392,0.0204,0.081846565,0.906508327,0.011645114,0
4,23,"According to the study, viral shedding in fecal matter is not a significant source of transmission for COVID-19, and it is not necessary to include fecal testing as part of the diagnostic criteria for the virus.",chatgpt,False,34.94,0.0,17.3,11.04,19.6,12.0,11,24.0,11,21.07,11th and 12th grade,211,36,4.81,0,1,0.78,0.0145,0.0737,0.007432547,0.989512742,0.003054697,0
130,41,"While Test A failed to detect SARS-CoV-2 antibodies in 3784% of non-hospitalised patients, Test B detected antibodies in 79%. Test C detected antibodies in 95% of non-hospitalised patients. Antibody levels were initially low, increased over time, and increased as the disease got worse.",human,True,48.5,13.0,10.0,13.27,12.6,12.06,10,10.16666667,10,10.37,12th and 13th grade,288,40,5.67,4,3,0.72,0.0168,0.0302,0.994751155,0.002034464,0.0032144,1
206,9,"patients with covid-19 with recurrent epileptic seizures had more underlying neurological diseases than patients who had a history of epilepsy but without convulsions. patients with recurrent and starting epileptic seizures suffered a more serious/critical covid-19, which can lead to a worse prognosis.",augmented,True,33.24,0.0,13.8,18.1,18.5,10.69,13,14.5,13,15.07,18th and 19th grade,303,43,6.0,0,2,0.72,0.0089,0.0259,0.993817747,0.002689179,0.003493088,1
224,13,"9.1% of all patients required access to the intensive care unit (icu), of which 83% died. the average length of icu residence was 11 days. correspondingly, the mortality rates for blood groups a, b, ab and 0 were 86.4%, 93.3%, 80.0%and 70.8%, showing similar mortality in all abo blood types. when the rh phenotype was taken into account, no significant changes were observed in the results.",augmented,True,66.54,10.8,7.3,8.28,8.4,13.14,14,7.4,14,10.13,7th and 8th grade,391,59,4.78,8,4,0.76,0.0113,0.0229,0.990275621,0.001948699,0.007775683,1
64,1,"Recent advancements in mRNA vaccines have revolutionized the field by enhancing protein translation, fine-tuning both innate and adaptive immunogenicity, and optimizing delivery mechanisms. These innovative vaccine formulations represent a cutting-edge approach to combatting infectious diseases and have emerged as trailblazers in the fight against COVID-19, obtaining worldwide authorization as the pioneering COVID-19 vaccines.",chatgpt,False,2.28,0.0,19.5,23.38,25.4,14.19,28,22.25,28,23.43,22nd and 23rd grade,430,53,7.04,0,2,0.83,0.8403,0.0161,0.008740991,0.979286909,0.01197207,0
40,27,"The evaluation results indicate promising diagnosis accuracy, ranging from 89% to 99%, suggesting the potential effectiveness of the proposed method for early detection and classification of COVID-19 through image processing using X-ray images. The method offers a streamlined approach with an end-to-end structure, minimizing the reliance on manual feature extraction and selection methods.",chatgpt,False,10.74,0.0,18.3,18.92,22.0,15.08,28,20.25,28,21.17,18th and 19th grade,391,51,6.43,2,2,0.88,0.8119,0.0101,0.976850748,0.00618991,0.016959384,0
123,34,"The COVID-19 epidemic could be controlled by alternating one or two weeks of complete lockdown with one or two months of freedom, respectively. Control strategies of this kind, where the lockdowns duration is well circumscribed, could be important also to alleviate coronavirus impact on economy.",human,True,40.18,0.0,13.2,14.74,16.3,11.42,14,15.75,14,16.11,15th and 16th grade,298,46,5.39,0,2,0.85,0.1093,0.0428,0.924985051,0.014407945,0.060607105,1
60,1,"When controlling for age, severity of illness, and co-morbidities, it was found that tocilizumab was not associated with fewer deaths in this study. However, further analysis revealed that the use of tocilizumab did result in a significant reduction in the duration of hospitalization and a lower incidence of severe respiratory complications among the treated patients.",chatgpt,False,26.64,0.0,16.4,15.61,19.4,11.6,21,20.25,21,19.73,19th and 20th grade,370,55,5.64,0,2,0.78,0.0931,0.0169,0.953228354,0.036913235,0.009858403,0
100,11,"150 patients were randomized to favipiravir or the control group. Median time to the cessation of viral shedding was 5 days versus 7 days, and median time to clinical cure was 3 days versus 5 days, for favipiravir and control, respectively. Adverse events were observed in 36% of favipiravir and 8% of control patients.",human,True,61.67,11.2,9.1,10.15,10.8,10.67,13,11.0,13,10.9,10th and 11th grade,319,47,5.28,6,3,0.6,0.032,0.0187,0.008830946,0.002694536,0.988474548,1
85,5,"A need for mechanical ventilation occurred in 31% of the anakinra-treated group and 75% of the control group. Successful weaning from supplemental oxygen was attained in 63% of the anakinra-treated group compared with 27% of the control group. Additionally, the anakinra-treated group exhibited a lower rate of ICU admissions (12%) compared to the control group (42%). The anakinra treatment also resulted in a shorter duration of hospital stay, with an average of 10 days for the treated group compared to 18 days for the control group.",chatgpt,False,49.65,13.8,11.7,11.89,14.1,10.39,21,14.25,21,13.25,13th and 14th grade,537,78,5.38,8,4,0.55,0.2887,0.0164,0.001129867,0.997259259,0.001610917,0
73,17,"Dietary supplements and vitamins, including vitamin D and high-dose vitamin C, have also been explored for COVID-19 treatment. Despite the promising claims and potential rationale behind their anti-COVID-19 activities, their preventive or therapeutic effectiveness has not been definitively established in randomized trials.",chatgpt,False,16.32,0.0,16.2,20.54,20.8,14.45,20,18.0,20,20.78,20th and 21st grade,324,42,6.62,0,2,0.88,0.1205,0.0152,0.983905733,0.003060528,0.013033694,0
187,4,the intravenous recombinant ace2 was reported as effective therapy for severe covid-19 by blocking the viral entry into the target cell.,augmented,True,33.24,0.0,13.8,14.21,15.1,14.45,10,15.5,10,17.92,13th and 14th grade,136,21,5.48,0,1,0.9,0.1763,0.0317,0.994216323,0.002933611,0.00285008,1
77,2,"Many people who are infected with the virus do not present with any clinical symptoms; current estimates suggest around 10% of individuals who have SARS-CoV-2 antibodies in their blood are asymptomatic. Those individuals carry the virus and potentially spread it to others, who may react with severe COVID-19 disease.",chatgpt,False,46.61,0.0,12.8,13.93,16.7,11.62,14,16.25,14,15.51,16th and 17th grade,317,48,5.46,1,3,0.83,0.0122,0.0807,0.992601573,0.002640877,0.004757552,0
9,1,"The modeled results of COVID-19 spread in New York State and the UK have demonstrated that testing and containment measures have no significant impact on the number of positive cases. The number of positive cases will continue to increase in both New York State and the UK throughout March 2021, regardless of the testing and containment measures.",chatgpt,False,51.01,0.0,13.2,12.25,16.9,10.31,14,18.25,14,15.61,12th and 13th grade,347,56,5.07,1,2,0.61,0.0565,0.0122,0.006453006,0.987022698,0.006524359,0
173,0,a 5-day course of ivermectin proved to be safe and effective in treating adult patients with mild covid-19.,augmented,True,78.59,0.0,6.8,10.44,11.1,13.3,4,9.0,4,9.42,6th and 7th grade,107,18,4.83,1,1,1.0,0.5583,0.0165,0.990924835,0.002507864,0.006567336,1
165,76,"Over the 14-day study period, six patients survived, two were extubated, and one discharged. The results implicate white blood cells as a therapeutic target for COVID-19.",human,True,58.28,0.0,8.4,12.63,11.4,12.18,9,7.5,9,11.35,7th and 8th grade,170,26,5.27,1,2,1.0,0.209,0.0167,0.456876159,0.004949316,0.53817451,1
43,28,"It is noteworthy that pure silver and silver-contained stainless steel surfaces do not demonstrate inhibitory effects on SARS-CoV-2 and H1N1 viruses. Conversely, the presence of pure copper and copper-contained stainless steel, particularly those with a high copper content, exhibits compelling antiviral properties.",chatgpt,False,33.24,0.0,13.8,19.43,19.9,12.2,16,14.5,16,14.11,13th and 14th grade,316,42,6.43,0,2,0.86,0.2636,0.0798,0.001023406,0.997987628,0.000988972,0
97,8,Microscopic abnormalities have been observed in both finger and toenails of patients with COVID-19. This suggests that chilblains might be a symptom of COVID-19.,human,True,67.76,0.0,6.8,14.2,11.7,10.81,7,6.0,7,8.13,6th and 7th grade,161,24,5.67,0,2,0.92,0.0132,0.0218,0.991993427,0.001889775,0.00611673,1
62,25,"We observed a substantial influence of age on ICU admissions. This is likely due to the fact that in the first wave of COVID-19 in Spain, a significant number of elderlies died in nursing homes before they could even be hospitalized or admitted to the ICU.",chatgpt,False,56.59,0.0,11.1,9.12,11.7,9.58,9,15.0,9,15.29,9th and 10th grade,256,46,4.52,0,2,0.8,0.0188,0.0283,0.319648623,0.028752858,0.651598573,0
166,77,A need for mechanical ventilation occurred in 31% of the anakinra-treated group and 75% of the control group. Successful weaning from supplemental oxygen was attained in 63% of the anakinra-treated group compared with 27% of the control group.,human,True,52.19,0.0,10.7,12.94,13.6,11.23,12,12.5,12,11.81,12th and 13th grade,243,34,5.65,4,2,0.65,0.2828,0.0206,0.00194186,0.995754123,0.002303985,1
136,47,"150 patients were randomized to favipiravir or the control group. Median time to the cessation of viral shedding was 5 days versus 7 days, and median time to clinical cure was 3 days versus 5 days, for favipiravir and control, respectively. Adverse events were observed in 36% of favipiravir and 8% of control patients.",human,True,61.67,11.2,9.1,10.15,10.8,10.67,13,11.0,13,10.9,10th and 11th grade,319,47,5.28,6,3,0.6,0.032,0.0187,0.008830946,0.002694536,0.988474548,1
82,15,"We found that the number of cases of SARS-CoV-2 infection showed significant variations in both barracks-style and apartment-style buildings. The rate of infection in barracks-style buildings was influenced by multiple factors, including the density of occupants and limited physical distancing measures. On the other hand, apartment-style buildings exhibited a range of infection rates, depending on factors such as ventilation systems and compliance with preventive measures.",chatgpt,False,32.53,17.1,14.1,18.51,19.3,11.76,22,16.83333333,22,18.53,18th and 19th grade,477,65,6.26,0,3,0.74,0.027,0.0318,0.008758735,0.986948609,0.004292646,0
109,20,"Migrant worker cases were younger, had few medical comorbidities and less severe disease. As the migrant worker cases increased, the proportion of patients with pneumonia decreased, whilst patients presenting earlier in their illness and asymptomatic disease became more common.",human,True,34.76,0.0,13.3,17.69,17.3,11.89,16,13.25,16,14.98,11th and 12th grade,278,39,6.03,0,2,0.85,0.0811,0.2325,0.982435584,0.001386197,0.016178202,1
