,statement_id,statement,creator,validity,True_fleshes,True_smog_index,True_flesch_kincaid_grade,True_coleman_liau_index,True_automated_readability_index,True_dale_chall_readability_score,True_difficult_words,True_linsear_write_formula,True_difficult_words.1,True_gunning_fog,True_text_standard,characters,words,avg_word_length,numbers,sentences,unique_word_ratio,sentiment_index,hatred_index,support,opposed,neutral,Label
74,7,"Many people who are infected with the virus do not present with any clinical symptoms, making it challenging to identify and control the spread of the disease. Current estimates suggest that a substantial proportion, approximately 30%, of individuals who have SARS-CoV-2 antibodies in their blood remain asymptomatic throughout the course of the infection. These asymptomatic individuals unknowingly carry the virus and have the potential to unknowingly transmit it to others, thereby playing a significant role in the further spread of the disease. Consequently, it becomes crucial to implement comprehensive testing and contact tracing measures to detect and isolate asymptomatic carriers in order to prevent the transmission and mitigate the risk of severe COVID-19 disease in vulnerable populations.",chatgpt,False,24.82,18.0,17.1,16.72,20.8,12.11,43,18.25,43,19.58,17th and 18th grade,803,116,5.82,1,4,0.66,0.012,0.1097,0.722627819,0.007324618,0.270047456,0
217,11,"150 patients were randomly assigned to favipiravir or the control group. the median time for the cessation of viral detachment was 5 days versus 7 days, and the median time for the clinical cure was 3 days versus 5 days, for favipiravir and control, respectively. adverse events were observed in 36% of favipiravir and 8% of control patients.",augmented,True,60.35,11.9,9.6,10.44,11.4,10.58,14,12.0,14,11.86,11th and 12th grade,342,51,5.24,6,3,0.55,0.0271,0.0161,0.009032118,0.002780367,0.988187492,1
135,46,"While molecular testing has been the primary means of diagnosing acute COVID-19 infection, blood testing is gaining importance for diagnosing minor infections or supporting the diagnosis of difficulty breathing in cases where the pathogen is no longer detectable in the upper respiratory tract.",human,True,10.91,0.0,22.4,17.19,27.7,13.85,16,32.5,16,26.5,-1th and 0th grade,294,43,5.81,0,1,0.81,0.0782,0.029,0.994181335,0.002456937,0.00336167,1
1,16,"COVID-19 patients with asthma had a significantly increased risk for mortality in Europe, North America, and South America, but not in Asia.",chatgpt,False,40.69,0.0,13.1,12.76,15.1,11.9,6,15.0,6,12.44,12th and 13th grade,140,22,5.23,0,1,0.91,0.0232,0.0158,0.000945868,0.998168468,0.000885616,0
31,20,"The presence of certain naturally occurring compounds, such as terpenoids, flavonoids, and phenolic compounds, has been observed to potentially contribute to the recovery of patients with COVID-19. These compounds are believed to possess beneficial properties, including potential anti-inflammatory effects and immune system modulation.",chatgpt,False,15.81,0.0,16.4,21.17,21.5,14.25,23,16.75,23,19.76,16th and 17th grade,336,43,6.67,0,2,0.86,0.6037,0.0207,0.988831162,0.004998832,0.006170001,0
98,9,"COVID-19 patients with recurrent epileptic seizures had more underlying neurological diseases than patients who had an epilepsy history but without a seizure. Patients with new-onset and recurrent epileptic seizures suffered more severe/critical COVID-19, which may lead to a worse prognosis.",human,True,42.72,0.0,12.3,18.39,18.4,10.94,12,13.5,12,13.0,12th and 13th grade,292,41,6.07,0,2,0.78,0.0094,0.0203,0.994230866,0.002542784,0.003226342,1
210,10,"although molecular tests have been the main means to diagnose covid-19 acute infection, blood tests are gaining importance to diagnose minor infections or support the diagnosis of difficulty breathing in cases where the pathogen is no longer detectable in the upper respiratory tract.",augmented,True,19.37,0.0,21.2,15.86,26.6,14.22,15,30.5,15,24.64,-1th and 0th grade,284,43,5.58,0,1,0.84,0.0689,0.0344,0.994155526,0.002576282,0.003268278,1
124,35,"COVID-19 patients with recurrent epileptic seizures had more underlying neurological diseases than patients who had an epilepsy history but without a seizure. Patients with new-onset and recurrent epileptic seizures suffered more severe/critical COVID-19, which may lead to a worse prognosis.",human,True,42.72,0.0,12.3,18.39,18.4,10.94,12,13.5,12,13.0,12th and 13th grade,292,41,6.07,0,2,0.78,0.0094,0.0203,0.994230866,0.002542784,0.003226342,1
87,5,"A need for mechanical ventilation occurred in 31% of the anakinra-treated group and 75% of the control group. However, it is important to note that the anakinra-treated group had a significantly lower rate of ICU admissions (12%) compared to the control group (42%). Successful weaning from supplemental oxygen was attained in 63% of the anakinra-treated group, showcasing the efficacy of the treatment, while the control group showed a lower success rate of 27%.",chatgpt,False,46.81,15.0,12.8,12.6,16.0,10.68,19,16.5,19,14.1,12th and 13th grade,463,67,5.42,6,3,0.61,0.23,0.0151,0.002011972,0.99530077,0.002687305,0
28,20,"After a third Pfizer vaccine, both immunocompromised individuals and seniors reported experiences that closely mirrored the reactions observed with previous vaccinations. Notably, the majority of these reactions were self-resolving in nature. Among the systemic side effects reported, fatigue, myalgia, and fever emerged as the most frequently encountered symptoms, affecting 19.6%, 9.2%, and 8.1% of individuals respectively.",chatgpt,False,26.27,13.3,12.4,18.08,15.4,13.5,26,7.8,26,13.77,13th and 14th grade,426,53,6.55,3,3,0.83,0.0378,0.0264,0.076957718,0.911867082,0.01117522,0
95,6,Microscopic abnormalities have been observed in both finger and toenails of patients with COVID-19. This suggests that chilblains might be a symptom of COVID-19.,human,True,67.76,0.0,6.8,14.2,11.7,10.81,7,6.0,7,8.13,6th and 7th grade,161,24,5.67,0,2,0.92,0.0132,0.0218,0.991993427,0.001889775,0.00611673,1
94,5,A need for mechanical ventilation occurred in 31% of the anakinra-treated group and 75% of the control group. Successful weaning from supplemental oxygen was attained in 63% of the anakinra-treated group compared with 27% of the control group.,human,True,52.19,0.0,10.7,12.94,13.6,11.23,12,12.5,12,11.81,12th and 13th grade,243,34,5.65,4,2,0.65,0.2828,0.0206,0.00194186,0.995754123,0.002303985,1
26,17,"Grouping samples into pools of five for PCR testing not only significantly increased coronavirus testing capacity but also streamlined the overall testing process. This approach demonstrated comparable sensitivity to individual sample testing, ensuring accurate detection of the virus while optimizing resource utilization.",chatgpt,False,7.86,0.0,17.4,21.23,20.7,14.08,21,16.5,21,19.83,16th and 17th grade,323,42,6.64,0,2,0.88,0.3967,0.0184,0.208737016,0.78143692,0.00982616,0
157,68,"Of all the patients, 9.1% required admission to the intensive care unit (ICU), of whom 83% died. The average length of ICU stay was 11 days. The observed mortality rates in blood groups A, B, AB and 0 were 86.4%, 93.3%, 80.0% and 70.8%, respectively, indicating similar death rates in all ABO blood types. When the Rh phenotype was taken into consideration, no significant changes in results were seen.",human,True,69.89,10.0,6.0,7.11,6.3,12.59,14,5.357142857,14,9.76,5th and 6th grade,402,61,4.74,8,4,0.79,0.0106,0.0238,0.99196434,0.002640745,0.005394844,1
156,67,Early experience with COVID-19 patients suggests that gastrointestinal symptoms are common and associated with greater severity of illness.,human,True,19.37,0.0,15.0,21.11,19.5,15.06,9,13.0,9,16.09,14th and 15th grade,139,18,6.72,0,1,0.94,0.019,0.017,0.984045863,0.00713312,0.008820993,1
24,16,"Female COVID-19 patients demonstrated a lower susceptibility to severe dengue compared to male patients in the main analysis. Notably, the study highlighted that pre-existing comorbidities such as diabetes, hypertension, renal disease, and cardiovascular disease were associated with an increased risk of severe disease.",chatgpt,False,15.81,0.0,16.4,19.14,19.8,13.88,19,15.75,19,17.9,15th and 16th grade,320,43,6.33,0,2,0.86,0.0204,0.0635,0.351616502,0.634262621,0.014120933,0
42,9,"It is intriguing to discover that pure silver, silver-contained stainless steel surfaces, and various other commonly used materials, such as plastics and glass, do not display inhibitory effects on SARS-CoV-2 and H1N1 viruses. However, in stark contrast, both pure copper and copper-contained stainless steel, with their high copper content, exhibit remarkable and significant antiviral properties.",chatgpt,False,26.64,0.0,16.4,17.82,21.8,11.89,19,20.75,19,18.27,17th and 18th grade,398,55,6.07,0,2,0.85,0.2676,0.0507,0.001689334,0.996285915,0.002024753,0
185,4,intravenous recombinant ace2 was reported as an effective therapy in severe covid-19 when blocking viral entry into target cells.,augmented,True,26.81,0.0,14.2,16.01,15.6,16.21,10,14.5,10,18.13,15th and 16th grade,129,19,5.79,0,1,1.0,0.1752,0.0323,0.993782341,0.003023809,0.003193867,1
80,28,"We estimate that among 100,000 airline travelers, with no testing or screening, there would be approximately 850 actively infectious passengers. A pre-travel PCR test would reduce the number of infected passengers to around 730. A rapid antigen test on the day of travel would further decrease the number of infected passengers to approximately 690.",chatgpt,False,44.75,14.6,11.5,13.45,13.4,10.96,14,13.0,14,12.39,12th and 13th grade,349,50,5.5,4,3,0.72,0.0183,0.0784,0.005082995,0.992058456,0.002858545,0
78,17,"We estimate that among 100,000 airline travelers, with no testing or screening, there would be [MASK] actively infectious passengers. A pre-travel PCR test would reduce the number of infected passengers to [MASK]. A rapid antigen test on the day of travel would reduce the number of infected passengers to [MASK].",chatgpt,False,54.52,13.6,9.8,11.54,11.8,9.83,12,11.66666667,12,11.48,11th and 12th grade,313,49,5.02,1,3,0.67,0.019,0.1334,0.017762203,0.964810073,0.017427702,0
127,38,"COVID-19 patients with recurrent epileptic seizures had more underlying neurological diseases than patients who had an epilepsy history but without a seizure. Patients with new-onset and recurrent epileptic seizures suffered more severe/critical COVID-19, which may lead to a worse prognosis.",human,True,42.72,0.0,12.3,18.39,18.4,10.94,12,13.5,12,13.0,12th and 13th grade,292,41,6.07,0,2,0.78,0.0094,0.0203,0.994230866,0.002542784,0.003226342,1
159,70,"There appears to be an age gradient, with younger children seemingly less susceptible to SARS-CoV-2 and less likely to pass it on. The BNT162b2 vaccine appeared well tolerated in children aged 1215 years, although the study was too small to identify any rare side-effects.",human,True,57.61,0.0,10.7,12.01,14.2,11.55,11,14.0,11,13.35,13th and 14th grade,274,43,5.14,1,2,0.88,0.0856,0.0335,0.994630694,0.002405345,0.00296399,1
223,13,"of all patients, 9.1% required admission to the intensive care unit (icu), of which 83% died. the average duration of the uci stay was 11 days. the mortality rates observed in blood groups a, b, ab and 0 were 86.4%, 93.3%, 80.0%and 70.8%, respectively, indicating similar mortality rates in all abo blood types. when the rh phenotype was taken into account, no significant changes were observed in the results.",augmented,True,68.26,10.9,6.6,8.1,7.7,12.9,14,6.583333333,14,10.4,6th and 7th grade,410,62,4.79,8,4,0.73,0.0115,0.0214,0.993320882,0.001796063,0.004883003,1
203,6,"with fingers and toenails of patients with covid-19, microscopic anomalies were observed in both fingers and on toenails. this indicates that chilblains could be a symptom of covid-19.",augmented,True,65.73,0.0,7.6,13.62,12.0,10.53,8,7.0,8,8.46,7th and 8th grade,184,28,5.5,0,2,0.79,0.0203,0.0317,0.992478728,0.001902935,0.005618302,1
37,5,"The findings support the implementation of global recommendations to allocate COVID-19 vaccines based on age, with a particular focus on older age groups. The study observed that as the speed of vaccine rollout increased, certain relative differences between allocation strategies were observed to become less prominent.",chatgpt,False,31.21,0.0,14.6,17.06,18.2,12.67,19,15.5,19,16.16,15th and 16th grade,320,46,5.89,0,2,0.85,0.0858,0.0108,0.074421845,0.913107276,0.012470802,0
5,23,"Results from non-hospitalized patients show that viral shedding in fecal matter is a rare occurrence, and there is no need to take precautions or consider fecal testing as part of COVID-19 diagnosis.",chatgpt,False,30.54,0.0,17.0,13.07,19.3,12.63,11,21.0,11,19.05,12th and 13th grade,199,32,5.19,0,1,0.94,0.0305,0.0278,0.015364084,0.979607105,0.005028788,0
182,2,"during the 14 -day study period, six patients survived, two were extubated and one dispensed. the results imply white blood cells as a therapeutic target for covid-19.",augmented,True,57.77,0.0,8.6,11.13,9.9,11.91,9,7.25,9,9.84,9th and 10th grade,167,26,5.15,1,2,0.96,0.2341,0.0199,0.992514551,0.002138342,0.00534704,1
201,6,microscopic deformities have been observed in both the finger and nails of patients with covid-19. this indicates that chilblains may be a symptom of covid-19.,augmented,True,67.25,0.0,7.0,12.22,10.3,10.57,6,6.75,6,9.8,6th and 7th grade,159,25,5.32,0,2,0.92,0.0108,0.041,0.992147863,0.001946686,0.00590548,1
75,28,"Many people who are infected with the virus do not present with any clinical symptoms; current estimates suggest around 30% of individuals who have SARS-CoV-2 antibodies in their blood are asymptomatic. However, the presence of these individuals who carry the virus without displaying symptoms raises concerns about their potential to spread it to others, potentially resulting in severe COVID-19 disease.",chatgpt,False,32.57,0.0,16.2,15.91,20.7,11.97,19,21.0,19,18.67,20th and 21st grade,405,59,5.73,1,3,0.78,0.02,0.0679,0.993134379,0.002626509,0.004239067,0
83,15,"We found that the number of cases of SARS-CoV-2 infection did not double every 1.56 days in barracks-style buildings. Instead, the rate of infection was relatively stable over time, indicating a more controlled spread within such communal settings. In contrast, apartment-style buildings exhibited a faster increase in cases, with the corresponding doubling time estimated to be 2.65 days.",chatgpt,False,48.3,11.2,10.1,14.03,12.8,11.16,16,8.25,16,10.63,10th and 11th grade,389,56,5.66,2,3,0.8,0.094,0.042,0.003510838,0.994302988,0.002186217,0
115,26,"While molecular testing has been the primary means of diagnosing acute COVID-19 infection, blood testing is gaining importance for diagnosing minor infections or supporting the diagnosis of difficulty breathing in cases where the pathogen is no longer detectable in the upper respiratory tract.",human,True,10.91,0.0,22.4,17.19,27.7,13.85,16,32.5,16,26.5,-1th and 0th grade,294,43,5.81,0,1,0.81,0.0782,0.029,0.994181335,0.002456937,0.00336167,1
143,54,Patients hospitalized and in the ICU because of COVID-19 have a higher metabolism and require more calories than their non-COVID counterparts.,human,True,41.7,0.0,12.7,15.61,16.4,12.95,7,13.5,7,14.11,12th and 13th grade,142,21,5.76,0,1,0.95,0.02,0.0176,0.991535068,0.003287067,0.005177932,1
13,10,"Without the initial lockdown, vaccination, and increased physical distancing, we estimated that a staggering 500 million COVID-19 cases and 20 million deaths would occur in the UK over just 5 years. Even in the best-case scenario, where vaccination is widely adopted, community transmission is still expected to be rampant, necessitating future periods of even more stringent physical distancing measures.",chatgpt,False,24.61,0.0,17.2,16.43,21.0,13.13,22,21.25,22,18.58,20th and 21st grade,405,56,5.95,3,2,0.84,0.016,0.0477,0.003694424,0.991343617,0.00496196,0
68,1,"We investigated the potential susceptibility of the central nervous system to viral invasion. Early reports from Wuhan initially suggested that a small percentage of COVID-19 patients displayed neurological symptoms. However, subsequent European studies revealed a much higher prevalence, with a significant majority of patients, approximately 60%, exhibiting such symptoms. Additionally, there have been documented cases of viral encephalitis associated with the infection.",chatgpt,False,4.98,15.9,16.4,20.01,17.7,13.57,32,12.75,32,18.46,15th and 16th grade,474,61,6.57,1,4,0.82,0.0232,0.0518,0.359829128,0.592366517,0.047804426,0
209,9,"covid-19 patients with recurrent epileptic seizures had more underlying neurological diseases than patients who had an epilepsy history but without seizures. patients with newly started and recurring epileptic seizures suffered more difficult/critical covid-19, which can lead to a poorer prognosis.",augmented,True,34.26,0.0,13.5,19.55,19.2,11.73,15,13.5,15,15.0,13th and 14th grade,299,41,6.24,0,2,0.78,0.0102,0.0238,0.994283617,0.002521306,0.003195063,1
174,0,a 5-day ivermectin course was found to be safe and effective in treating adult patients with mild covid-19.,augmented,True,78.59,0.0,6.8,10.44,11.1,12.42,4,9.0,4,9.42,6th and 7th grade,107,18,4.83,1,1,1.0,0.538,0.0154,0.991894186,0.004856663,0.00324911,1
178,1,"we rated 298 people and identified twelve positive cases. 75% of the positive cases were asymptomatic, while only 25% of the positive cases explained symptoms that suffered fever, diarrhea and cough. our data confirm the importance of early identification of asymptomatic carriers.",augmented,True,40.35,13.6,11.1,14.32,12.5,10.72,14,10.33333333,14,12.27,10th and 11th grade,281,39,5.79,3,3,0.72,0.4844,0.019,0.994397759,0.002005837,0.003596438,1
108,19,"Observations so far suggest a mean incubation period of 5 days and median incubation period of 45 days from exposure to the onset of symptoms. Viral RNA is detectable in the airways 23 days before the onset of symptoms, peaks at the onset of symptoms, and decreases over the following 78 days in most patients.",human,True,43.56,0.0,14.0,9.58,14.5,11.32,13,18.25,13,15.36,14th and 15th grade,316,51,4.8,4,2,0.63,0.0386,0.0315,0.994207025,0.001961394,0.00383156,1
17,16,"In the phase 1 trial, the potential vaccine formula exhibited a strong antibody response that remained elevated in all participants 3 months after the second vaccination. In the phase 2 trial, the potential vaccine formula demonstrated promising safety outcomes.",chatgpt,False,26.3,0.0,14.4,15.43,15.4,12.3,14,14.75,14,16.01,14th and 15th grade,262,36,6.03,3,2,0.72,0.8002,0.0197,0.002535179,0.996164322,0.001300406,0
55,7,"Different amounts of antibodies produced after the two doses of vaccine were found. Notably, individuals with a previous natural infection exhibited a higher level of antibodies. Among individuals with no history of past SARS-CoV-2 infection, a small percentage (approximately 5%) displayed antibody levels comparable to those of infected individuals, suggesting potential asymptomatic acquisition of the infection. In such individuals, it is speculated that a single dose of the vaccine may be sufficient to generate a protective immune response.",chatgpt,False,9.38,18.0,16.8,16.71,16.7,11.49,28,16.5,28,17.54,16th and 17th grade,547,77,5.95,1,4,0.73,0.044,0.0418,0.006146042,0.991253793,0.002600197,0
39,11,"The evaluation results reveal a notable range of diagnosis accuracy, spanning from 89% to 99%, indicating the need for further refinement. The proposed method for early detection and classification of COVID-19 through image processing using X-ray images necessitates careful consideration due to its reliance on an end-to-end structure, which eliminates the potential benefits associated with manual feature extraction and manual selection methods.",chatgpt,False,6.17,0.0,20.1,18.46,23.5,14.34,29,24.5,29,23.37,23rd and 24th grade,448,60,6.27,2,2,0.88,0.2444,0.0146,0.951847672,0.01079881,0.037353408,0
172,0,it has been found that a 5-day ivermectin course is safe and effective in the treatment of adult patients with light covid-19.,augmented,True,82.99,0.0,7.2,9.63,12.0,10.47,4,12.0,4,10.62,11th and 12th grade,126,22,4.64,1,1,1.0,0.5372,0.0153,0.993038952,0.003690298,0.003270868,1
72,17,"Dietary supplements and vitamins, including vitamin D and high-dose vitamin C, have also been reportedly used for COVID-19 treatment. Despite their utilization and the potential rationale behind their anti-COVID-19 activities, their preventive or therapeutic effectiveness has not been fully confirmed in randomized trials.",chatgpt,False,15.81,0.0,16.4,19.43,20.1,13.52,19,18.25,19,20.69,20th and 21st grade,323,43,6.42,0,2,0.86,0.0652,0.0184,0.969330668,0.004797013,0.02587232,0
133,44,"Among those with moderate COVID-19 disease, time to clinical improvement was 7 days in the CBP group, versus 8 days in the control group. The data show that administration of CBP is a safe treatment option for patients with COVID-19 disease with a favorable outcome in the rate of, and time to, clinical improvement.",human,True,52.53,0.0,12.6,10.39,15.0,10.53,13,17.0,13,14.5,14th and 15th grade,316,52,4.9,2,2,0.67,0.4753,0.0124,0.987557173,0.001324917,0.011117936,1
152,63,"Compared to White respondents, American Indian/Alaska Native and Black/African American respondents were less likely, and Asian and Spanish-speaking Latino respondents were more likely to report being extremely likely to be vaccinated.",human,True,6.17,0.0,20.1,20.55,25.2,10.78,9,24.5,9,16.27,20th and 21st grade,235,33,6.06,0,1,0.7,0.0629,0.027,0.993548334,0.001998829,0.004452825,1
192,4,"intravenous recombinant ace2 has been reported as an effective covid-19 therapy, blocking viral input into target cells.",augmented,True,28.84,0.0,13.5,16.88,15.9,16.55,9,13.5,9,18.56,13th and 14th grade,120,17,6.0,0,1,1.0,0.1291,0.0307,0.99371475,0.002764351,0.00352088,1
177,1,"we rated 298 people and identified twelve positive cases. 75% of positive cases were asymptomatic, while only 25% of positive cases reported symptoms containing fever, diarrhea and cough. our knowledge confirms the importance of early identification of asymptomatic carriers.",augmented,True,32.9,14.6,11.9,16.05,13.7,11.16,14,10.5,14,14.43,11th and 12th grade,275,36,6.19,3,3,0.75,0.4261,0.0208,0.994092762,0.002224058,0.003683149,1
38,10,"The comprehensive evaluation results unequivocally demonstrate the exceptional diagnosis accuracy ranging from 89% to an impressive 99%. The proposed method for early detection and classification of COVID-19 through image processing utilizing X-ray images not only showcases its usability but also boasts an end-to-end structure that eliminates the requirement for manual feature extraction and selection methods, streamlining the diagnostic process.",chatgpt,False,-0.78,0.0,20.7,20.95,24.6,15.0,29,24.75,29,25.36,24th and 25th grade,450,57,6.72,2,2,0.89,0.9205,0.0113,0.915359318,0.01471354,0.069927149,0
200,6,microscopic abnormalities were observed in both fingers and nails of patients with covid-19. this suggests that chilblin can be a symptom of covid-19.,augmented,True,68.26,0.0,6.6,12.8,10.6,11.76,7,5.75,7,8.08,6th and 7th grade,150,23,5.48,0,2,0.91,0.0145,0.0362,0.982047796,0.00436179,0.013590407,1
205,7,"we arrive at a consensus on the applicability of diagnostic tools to provide test algorithms for the use of high affinity antibody antibody tests for asymptomatic subjects exposed to sars-cov-2. antibody tests for high affinity antibodies must be carried out ideally 21 days after the potential infectious contact, since most exposed people will have begun to produce antibodies by then.",augmented,True,24.11,0.0,17.4,14.52,19.3,11.44,17,22.5,17,19.33,-1th and 0th grade,387,59,5.47,1,2,0.76,0.0952,0.0424,0.947914481,0.002140382,0.04994522,1
15,17,"With the initial lockdown, vaccination, and increased physical distancing, we estimated a significant reduction in COVID-19 cases and deaths in the UK over 10 years. In the best-case scenario, vaccination effectively suppresses community transmission without the need for future periods of increased physical distancing.",chatgpt,False,15.31,0.0,16.6,18.16,19.2,12.98,17,18.0,17,18.8,18th and 19th grade,320,43,6.26,1,2,0.79,0.4545,0.0434,0.004135635,0.991279662,0.004584763,0
195,5,a need for mechanical ventilation occurred in 31% of the group treated in anakinra and 75% of the control group. a successful weaning of additional oxygen was reached in 63% of the group treated in anakinra against 27% of the control group.,augmented,True,58.62,0.0,10.3,9.4,11.4,10.32,10,12.5,10,12.21,9th and 10th grade,240,38,4.87,4,2,0.55,0.2032,0.0246,0.992630482,0.003876366,0.003493169,1
197,5,the need for mechanical ventilation occurred in 31% of the group treated with anakinra and 75% of the control group. successful weaning of supplemental oxygen was reached in 63% of the group treated with anakinra compared to 27% of the control group.,augmented,True,58.62,0.0,10.3,10.73,12.5,10.69,11,12.5,11,12.21,10th and 11th grade,250,38,5.13,4,2,0.58,0.1395,0.0257,0.9933514,0.003394725,0.003253808,1
220,12,"a significant number of infected medical workers were 28.9% asymptomatic, and 35.5% were hospitalized. the average length of stay in the hospital was 8.1 days. 70.1% of confirmed cases were vaccinated against seasonal flu.",augmented,True,56.11,10.8,7.1,10.15,8.2,13.26,11,4.2,11,12.13,10th and 11th grade,222,30,5.57,4,3,0.83,0.0282,0.0379,0.993767858,0.002813627,0.003418562,1
117,28,"There appears to be an age gradient, with younger children seemingly less susceptible to SARS-CoV-2 and less likely to pass it on. The BNT162b2 vaccine appeared well tolerated in children aged 1215 years, although the study was too small to identify any rare side-effects.",human,True,57.61,0.0,10.7,12.01,14.2,11.55,11,14.0,11,13.35,13th and 14th grade,274,43,5.14,1,2,0.88,0.0856,0.0335,0.994630694,0.002405345,0.00296399,1
