,statement_id,statement,creator,validity,True_fleshes,True_smog_index,True_flesch_kincaid_grade,True_coleman_liau_index,True_automated_readability_index,True_dale_chall_readability_score,True_difficult_words,True_linsear_write_formula,True_difficult_words.1,True_gunning_fog,True_text_standard,characters,words,avg_word_length,numbers,sentences,unique_word_ratio,sentiment_index,hatred_index,support,opposed,neutral,Label
114,25,Patients hospitalized and in the ICU because of COVID-19 have a higher metabolism and require more calories than their non-COVID counterparts.,human,True,41.7,0.0,12.7,15.61,16.4,12.95,7,13.5,7,14.11,12th and 13th grade,142,21,5.76,0,1,0.95,0.02,0.0176,0.991535068,0.003287067,0.005177932,1
186,4,ace2 intravenous recombinant has been reported as effective therapy in severe covvi-19 by blocking viral entry to target cells.,augmented,True,26.81,0.0,14.2,15.37,15.1,16.21,11,14.5,11,18.13,14th and 15th grade,127,19,5.68,0,1,1.0,0.2529,0.0259,0.994026542,0.002164283,0.003809196,1
218,11,"150 patients were randomized to favipiravir or the control group. the median time at the cessation of viral spreading was 5 days against 7 days and the median time to clinical care was 3 days against 5 days, respectively for favipiravir and control. adverse events were observed in 36% of favipiravir and 8% of control patients.",augmented,True,69.41,11.2,8.2,10.39,10.9,10.2,12,11.33333333,12,11.05,10th and 11th grade,328,49,5.24,6,3,0.57,0.0241,0.0194,0.989932179,0.001665965,0.008401933,1
51,2,"The proposed innovative technique, which shares striking similarities with the widely adopted PCR testing technique, demonstrated exceptional performance. The remarkable results obtained unequivocally emphasize the immense application potential of this groundbreaking, simple, and cost-effective magneto-assay for enabling saliva-based point-of-care COVID-19 diagnosis.",chatgpt,False,-8.56,0.0,19.5,27.55,26.6,16.59,26,17.25,26,21.86,16th and 17th grade,369,41,7.88,0,2,0.93,0.9544,0.0111,0.118174039,0.849320352,0.032505654,0
213,10,"although the molecular test was the main means of diagnosing the acute covid-19 infection, the blood test is of importance to diagnosing minor infections or supporting the diagnosis of difficulty breathing in cases where the nurse is no longer discovered in the upper respiratory system.",augmented,True,8.88,0.0,23.2,14.52,26.5,12.89,15,33.5,15,26.89,26th and 27th grade,287,45,5.36,0,1,0.73,0.0479,0.0271,0.994064867,0.002778471,0.003156597,1
155,66,"We found that age, symptom onset between 3 and 14 days, fever or history of fever, cough, sore throat, ageusia (loss of taste), anosmia (loss of smell), chest pain, myalgia (muscle aches and pains) and/or arthralgia (join pain), household cluster, and evidence of confirmed cases in the neighbourhood could help discriminate infected patients from uninfected.",human,True,24.11,0.0,23.6,13.65,32.2,12.68,17,33.5,17,25.64,12th and 13th grade,359,54,5.22,2,1,0.81,0.0441,0.0481,0.986023068,0.001984976,0.01199201,1
122,33,Children with serious underlying medical conditions had a 1.79 times higher risk of severe COVID-19 than for healthy children. Children with obesity were found to be 2.87 times more likely to get severe COVID-19 than healthy children. Children with underlying conditions also had a 2.81 times higher risk of death from COVID-19 compared to healthy children.,human,True,70.5,9.3,5.7,11.28,8.6,8.89,8,4.833333333,8,7.29,8th and 9th grade,357,53,5.42,3,3,0.57,0.012,0.0383,0.105568521,0.875800014,0.018631438,1
126,37,Early experience with COVID-19 patients suggests that gastrointestinal symptoms are common and associated with greater severity of illness.,human,True,19.37,0.0,15.0,21.11,19.5,15.06,9,13.0,9,16.09,14th and 15th grade,139,18,6.72,0,1,0.94,0.019,0.017,0.984045863,0.00713312,0.008820993,1
144,55,"Global influenza virus spread decreased during the COVID-19 pandemic, possibly due to widespread community mitigation measures.",human,True,12.94,0.0,15.4,21.92,19.5,16.27,9,13.0,9,18.9,12th and 13th grade,127,16,6.88,0,1,1.0,0.1379,0.0427,0.009415693,0.986026287,0.004558037,1
147,58,"The COVID-19 epidemic could be controlled by alternating one or two weeks of complete lockdown with one or two months of freedom, respectively. Control strategies of this kind, where the lockdowns duration is well circumscribed, could be important also to alleviate coronavirus impact on economy.",human,True,40.18,0.0,13.2,14.74,16.3,11.42,14,15.75,14,16.11,15th and 16th grade,298,46,5.39,0,2,0.85,0.1093,0.0428,0.924985051,0.014407945,0.060607105,1
128,39,"Oxygen saturation in central venous blood, oxygen consumption and oxygen extraction are good predictors of mortality in critically ill patients with COVID-19.",human,True,15.31,0.0,16.6,18.04,18.9,13.34,10,17.0,10,19.71,16th and 17th grade,158,22,6.14,0,1,0.91,0.0299,0.0224,0.967184961,0.015250013,0.017565025,1
170,0,a five-day ivermectin course was found to be safe and effective to treat adult patients with mild covid-19.,augmented,True,78.59,0.0,6.8,10.44,11.1,10.67,3,9.0,3,9.42,10th and 11th grade,107,18,4.94,0,1,0.94,0.4824,0.0154,0.991917074,0.004687797,0.003395013,1
50,5,"It is evident that the virus did not solely rely on car travel on highways and motorways for its transmission. Contrary to initial perceptions, ""solo"" driving, referring to traveling by passenger cars, was not a significant factor that contributed to the initial spread, but rather played a minimal role.",chatgpt,False,46.61,0.0,12.8,12.36,15.4,11.94,18,17.25,18,17.15,12th and 13th grade,304,49,5.06,0,2,0.84,0.0218,0.05,0.860586643,0.057843443,0.081569821,0
